{
  "channel": "<channel>",
  "command": "packet",
  "data": {
    "packet": {
      "artifacts": [
        {
          "artifact_kind": "review-notes",
          "event_id": "evt_1",
          "origin": "local",
          "ref_task_id": null,
          "subject": "packet implementation notes",
          "summary": null,
          "uri": "crates/rally-core/src/context.rs"
        }
      ],
      "decisions": [
        {
          "event_id": "evt_2",
          "origin": "local",
          "rationale": null,
          "scope": "crates/rally-core/src/context.rs",
          "status": "binding",
          "subject": "packets are read-only derived state",
          "supersedes": []
        }
      ],
      "files": [
        "crates/rally-core/src/context.rs"
      ],
      "focus": [
        {
          "event_id": "evt_1",
          "factors": [
            "artifact:review-notes",
            "profile_watch:crates/rally-core",
            "role:reviewer",
            "local"
          ],
          "kind": "artifact",
          "origin": "local",
          "paths": [
            "crates/rally-core/src/context.rs"
          ],
          "score": 108,
          "source_event_ids": [
            "evt_1"
          ],
          "subject": "packet implementation notes"
        },
        {
          "event_id": "evt_2",
          "factors": [
            "decision:binding",
            "profile_watch:crates/rally-core",
            "role:reviewer",
            "local"
          ],
          "kind": "decision",
          "origin": "local",
          "paths": [
            "crates/rally-core/src/context.rs"
          ],
          "score": 93,
          "source_event_ids": [
            "evt_2"
          ],
          "subject": "packets are read-only derived state"
        },
        {
          "event_id": "evt_3",
          "factors": [
            "lesson:coordination",
            "role:reviewer",
            "local"
          ],
          "kind": "lesson",
          "origin": "local",
          "score": 61,
          "source_event_ids": [
            "evt_3"
          ],
          "subject": "packets preserve source-linked context"
        },
        {
          "event_id": "evt_4",
          "factors": [
            "recent_change",
            "local",
            "fresh"
          ],
          "kind": "recent_profile",
          "origin": "local",
          "score": 31,
          "source_event_ids": [
            "evt_4"
          ],
          "subject": "profile codex-reviewer"
        }
      ],
      "lessons": [
        {
          "confidence": 0.8,
          "event_id": "evt_3",
          "lesson_kind": "coordination",
          "origin": "local",
          "scope": null,
          "source_event_ids": [],
          "subject": "packets preserve source-linked context"
        }
      ],
      "packet_kind": "review",
      "profile": {
        "availability": null,
        "branch": null,
        "capabilities": [
          "review"
        ],
        "current_task": null,
        "event_id": "evt_4",
        "notes": null,
        "origin": "local",
        "role": "reviewer",
        "tool": "codex-reviewer",
        "watch": [
          "crates/rally-core"
        ]
      },
      "recommended_next_action": {
        "action": "review_artifact",
        "confidence": 0.72,
        "minimum_trust_for_automation": "local-or-trusted",
        "reason": "reviewer profile is best matched to artifact",
        "source_event_ids": [
          "evt_1"
        ],
        "target": "evt_1",
        "trust": {
          "automation_allowed": true,
          "required": "local-or-trusted",
          "source_statuses": [
            {
              "event_id": "evt_1",
              "origin": "local",
              "trust_status": "local"
            }
          ]
        }
      },
      "review_targets": [
        {
          "event_id": "evt_1",
          "factors": [
            "artifact:review-notes",
            "profile_watch:crates/rally-core",
            "role:reviewer",
            "local"
          ],
          "kind": "artifact",
          "origin": "local",
          "paths": [
            "crates/rally-core/src/context.rs"
          ],
          "score": 108,
          "source_event_ids": [
            "evt_1"
          ],
          "subject": "packet implementation notes"
        },
        {
          "event_id": "evt_2",
          "factors": [
            "decision:binding",
            "profile_watch:crates/rally-core",
            "role:reviewer",
            "local"
          ],
          "kind": "decision",
          "origin": "local",
          "paths": [
            "crates/rally-core/src/context.rs"
          ],
          "score": 93,
          "source_event_ids": [
            "evt_2"
          ],
          "subject": "packets are read-only derived state"
        },
        {
          "event_id": "evt_3",
          "factors": [
            "lesson:coordination",
            "role:reviewer",
            "local"
          ],
          "kind": "lesson",
          "origin": "local",
          "score": 61,
          "source_event_ids": [
            "evt_3"
          ],
          "subject": "packets preserve source-linked context"
        }
      ],
      "role": "reviewer",
      "source_event_ids": [
        "evt_1",
        "evt_2",
        "evt_3",
        "evt_4"
      ],
      "tool": "codex-reviewer",
      "trust_summary": {
        "invalid": 0,
        "local": 4,
        "minimum_trust_for_automation": "local-or-trusted",
        "recommendation_automation_allowed": true,
        "trusted": 0,
        "unknown": 0,
        "unsigned": 0,
        "untrusted": 0
      }
    }
  },
  "ok": true,
  "schema": "agent-rally.command.packet.v1"
}
